<?xml version="1.0" encoding="UTF-8"?>
<disp:display xmlns:disp="http://www.sparna.fr/thesaurus-display" xmlns:xsi="http://www.w3.org/2001/XMLSchema-instance" xsi:schemaLocation="http://www.sparna.fr/thesaurus-display thesaurus-display.xsd ">
  <disp:header>
    <disp:title>disp:title</disp:title>
    <disp:date>2001-12-31T12:00:00</disp:date>
  </disp:header>
  <disp:alphabetical>
    <disp:term disp:conceptId="http://tempuri.org" disp:type="pref">
      <disp:label>disp:label</disp:label>
      <disp:CC>disp:CC</disp:CC>
      <disp:SN>disp:SN</disp:SN>
      <disp:UF>disp:UF</disp:UF>
      <disp:TT>
        <disp:term disp:conceptId="http://tempuri.org" disp:type="pref">
          <disp:label>disp:label</disp:label>
        </disp:term>
      </disp:TT>
      <disp:BT>
        <disp:term disp:conceptId="http://tempuri.org" disp:type="pref">
          <disp:label>disp:label</disp:label>
        </disp:term>
      </disp:BT>
      <disp:NT>
        <disp:term disp:conceptId="http://tempuri.org" disp:type="pref">
          <disp:label>disp:label</disp:label>
        </disp:term>
      </disp:NT>
      <disp:RT>
        <disp:term disp:conceptId="http://tempuri.org" disp:type="pref">
          <disp:label>disp:label</disp:label>
        </disp:term>
      </disp:RT>
      <disp:DEF>disp:DEF</disp:DEF>
      <disp:HN>disp:HN</disp:HN>
      <disp:SC>disp:SC</disp:SC>
      <disp:USE>
        <disp:term disp:conceptId="http://tempuri.org" disp:type="pref">
          <disp:label>disp:label</disp:label>
        </disp:term>
      </disp:USE>
    </disp:term>
  </disp:alphabetical>
</disp:display>
